{
  "schema_version": "1.0",
  "pack_id": "pack-20260807074344701780-f226577d",
  "profile": "methodology",
  "kind": "verified",
  "status": "confirmed",
  "accepted": [
    "distribution-before-aggregate",
    "feedback-integrity",
    "protected-dissent-channel"
  ],
  "degraded": [
    {
      "id": "anti-dogmatism-correction",
      "disposition": "shared-principle"
    },
    {
      "id": "center-work-coordination",
      "disposition": "shared-principle"
    },
    {
      "id": "contradiction-reclassification",
      "disposition": "shared-principle"
    },
    {
      "id": "investigation-before-judgment",
      "disposition": "shared-principle"
    },
    {
      "id": "practice-test-loop",
      "disposition": "shared-principle"
    },
    {
      "id": "relational-problem-map",
      "disposition": "shared-principle"
    },
    {
      "id": "rights-bound-transfer",
      "disposition": "governance"
    },
    {
      "id": "stage-experimentation",
      "disposition": "shared-principle"
    },
    {
      "id": "version-attribution",
      "disposition": "governance"
    }
  ],
  "merged": [],
  "rejected": [
    {
      "id": "candidate-20260807074344779287-663d86dc",
      "reason": "V1 requires recurrence in at least two source contexts; candidate may be generic or underspecified"
    },
    {
      "id": "candidate-20260807074344779334-5145db33",
      "reason": "V1 requires recurrence in at least two source contexts; candidate is not yet executable"
    },
    {
      "id": "candidate-20260807074344779363-2346b81d",
      "reason": "V1 requires recurrence in at least two source contexts"
    },
    {
      "id": "candidate-20260807074344779410-1fda6fc0",
      "reason": "V1 requires recurrence in at least two source contexts"
    },
    {
      "id": "candidate-20260807074344779427-6125d226",
      "reason": "V1 requires recurrence in at least two source contexts; candidate is not yet executable; candidate may be generic or underspecified"
    },
    {
      "id": "candidate-20260807074344779533-5aa06d70",
      "reason": "V1 requires recurrence in at least two source contexts"
    },
    {
      "id": "candidate-20260807074344779555-798f7f15",
      "reason": "V1 requires recurrence in at least two source contexts"
    },
    {
      "id": "candidate-20260807074344779598-96ab5418",
      "reason": "V1 requires recurrence in at least two source contexts"
    },
    {
      "id": "candidate-20260807074344779693-1a0696e1",
      "reason": "V1 requires recurrence in at least two source contexts"
    },
    {
      "id": "candidate-20260807074344779709-bef708f1",
      "reason": "V1 requires recurrence in at least two source contexts; candidate is not yet executable; candidate may be generic or underspecified"
    },
    {
      "id": "candidate-20260807074344779730-a105b9c6",
      "reason": "V1 requires recurrence in at least two source contexts; candidate is not yet executable"
    },
    {
      "id": "candidate-20260807074344779773-ab7c6730",
      "reason": "V1 requires recurrence in at least two source contexts"
    },
    {
      "id": "candidate-20260807074344779802-142bbc01",
      "reason": "V1 requires recurrence in at least two source contexts; candidate is not yet executable"
    },
    {
      "id": "candidate-20260807074344779941-cc270a2e",
      "reason": "V1 requires recurrence in at least two source contexts; candidate is not yet executable"
    },
    {
      "id": "candidate-20260807074344780085-376d642f",
      "reason": "V1 requires recurrence in at least two source contexts"
    },
    {
      "id": "candidate-20260807074344780102-26612677",
      "reason": "V1 requires recurrence in at least two source contexts"
    },
    {
      "id": "candidate-20260807074344780157-8d3a1c10",
      "reason": "V1 requires recurrence in at least two source contexts"
    },
    {
      "id": "candidate-20260807074344780184-3b904788",
      "reason": "V1 requires recurrence in at least two source contexts; candidate is not yet executable"
    },
    {
      "id": "candidate-20260807074344780230-ca4999ce",
      "reason": "V1 requires recurrence in at least two source contexts"
    },
    {
      "id": "candidate-20260807074344780318-92c8156f",
      "reason": "V1 requires recurrence in at least two source contexts"
    },
    {
      "id": "candidate-20260807074344780339-09b5ff13",
      "reason": "V1 requires recurrence in at least two source contexts"
    },
    {
      "id": "candidate-20260807074344780409-3e73d0db",
      "reason": "V1 requires recurrence in at least two source contexts; candidate may be generic or underspecified"
    },
    {
      "id": "candidate-20260807074344780434-f58614b4",
      "reason": "V1 requires recurrence in at least two source contexts"
    },
    {
      "id": "candidate-20260807074344780547-67b20b26",
      "reason": "V1 requires recurrence in at least two source contexts; candidate is not yet executable; candidate may be generic or underspecified"
    },
    {
      "id": "candidate-20260807074344780574-d9dc8b1f",
      "reason": "V1 requires recurrence in at least two source contexts"
    },
    {
      "id": "candidate-20260807074344780669-dd7d185d",
      "reason": "V1 requires recurrence in at least two source contexts"
    },
    {
      "id": "candidate-20260807074344780721-f26c10cb",
      "reason": "V1 requires recurrence in at least two source contexts; candidate is not yet executable"
    },
    {
      "id": "candidate-20260807074344780772-776fe090",
      "reason": "V1 requires recurrence in at least two source contexts"
    },
    {
      "id": "candidate-20260807074344780876-f0c64a94",
      "reason": "V1 requires recurrence in at least two source contexts"
    },
    {
      "id": "candidate-20260807074344780902-91357a7b",
      "reason": "V1 requires recurrence in at least two source contexts; candidate is not yet executable"
    },
    {
      "id": "candidate-20260807074344780956-a9f147b5",
      "reason": "V1 requires recurrence in at least two source contexts"
    },
    {
      "id": "candidate-20260807074344781027-ff17e703",
      "reason": "V1 requires recurrence in at least two source contexts"
    },
    {
      "id": "candidate-20260807074344781044-ac68f5b9",
      "reason": "V1 requires recurrence in at least two source contexts; candidate may be generic or underspecified"
    },
    {
      "id": "candidate-20260807074344781070-351b2a97",
      "reason": "V1 requires recurrence in at least two source contexts"
    },
    {
      "id": "candidate-20260807074344781143-8b3b7118",
      "reason": "V1 requires recurrence in at least two source contexts; candidate is not yet executable"
    },
    {
      "id": "candidate-20260807074344781208-aae53afa",
      "reason": "V1 requires recurrence in at least two source contexts; candidate is not yet executable"
    },
    {
      "id": "candidate-20260807074344781229-c8c6ef52",
      "reason": "V1 requires recurrence in at least two source contexts"
    },
    {
      "id": "candidate-20260807074344781275-87bad603",
      "reason": "V1 requires recurrence in at least two source contexts"
    },
    {
      "id": "candidate-20260807074344781301-c1d7ba53",
      "reason": "V1 requires recurrence in at least two source contexts; candidate is not yet executable"
    },
    {
      "id": "candidate-20260807074344781374-656d2004",
      "reason": "V1 requires recurrence in at least two source contexts"
    },
    {
      "id": "candidate-20260807074344781393-1d4df5a5",
      "reason": "V1 requires recurrence in at least two source contexts"
    },
    {
      "id": "candidate-20260807074344781591-ad9aeea1",
      "reason": "V1 requires recurrence in at least two source contexts; candidate is not yet executable"
    },
    {
      "id": "candidate-20260807074344781643-dbfc4f90",
      "reason": "V1 requires recurrence in at least two source contexts; candidate is not yet executable"
    },
    {
      "id": "candidate-20260807074344781669-447148a1",
      "reason": "V1 requires recurrence in at least two source contexts"
    },
    {
      "id": "candidate-20260807074344781746-eae6a9bc",
      "reason": "V1 requires recurrence in at least two source contexts; candidate is not yet executable"
    },
    {
      "id": "candidate-20260807074344781801-ebad90e2",
      "reason": "V1 requires recurrence in at least two source contexts; candidate is not yet executable"
    },
    {
      "id": "candidate-20260807074344781865-a6b00f33",
      "reason": "V1 requires recurrence in at least two source contexts; candidate is not yet executable"
    },
    {
      "id": "candidate-20260807074344782004-daa6a67b",
      "reason": "V1 requires recurrence in at least two source contexts; candidate is not yet executable"
    },
    {
      "id": "candidate-20260807074344782058-518a8e4f",
      "reason": "V1 requires recurrence in at least two source contexts"
    },
    {
      "id": "candidate-20260807074344782120-cb565f17",
      "reason": "V1 requires recurrence in at least two source contexts; candidate is not yet executable"
    },
    {
      "id": "candidate-20260807074344782178-4979fff6",
      "reason": "V1 requires recurrence in at least two source contexts; candidate is not yet executable"
    },
    {
      "id": "candidate-20260807074344782227-4d87c6cf",
      "reason": "V1 requires recurrence in at least two source contexts"
    },
    {
      "id": "candidate-20260807074344782432-6254cbea",
      "reason": "V1 requires recurrence in at least two source contexts; candidate is not yet executable"
    },
    {
      "id": "candidate-20260807074344782457-d3329e0a",
      "reason": "V1 requires recurrence in at least two source contexts"
    },
    {
      "id": "candidate-20260807074344782508-e0079221",
      "reason": "V1 requires recurrence in at least two source contexts; candidate is not yet executable"
    },
    {
      "id": "candidate-20260807074344782528-96a9a274",